prot_acc,prot_desc,prot_score,prot_mass,prot_sequences_sig,emPAI_value
AHPC_ECOLI,Alkyl hydroperoxide reductase subunit C OS=Escherichia coli (strain K12) GN=ahpC PE=1 SV=2,100,20862,4,1.5
BFR_ECOLI,Bacterioferritin OS=Escherichia coli (strain K12) GN=bfr PE=1 SV=1,85,18483,1,0.29
RBSB_ECOLI,Ribose import binding protein RbsB OS=Escherichia coli (strain K12) GN=rbsB PE=1 SV=1,83,30931,3,0.59
HCHA_ECOBW,Protein deglycase HchA OS=Escherichia coli (strain K12 / MC4100 / BW2952) GN=hchA PE=3 SV=1,65,31285,2,0.36
DNAK_ECOHS,Chaperone protein DnaK OS=Escherichia coli O9:H4 (strain HS) GN=dnaK PE=3 SV=1,59,69146,1,0.07
EFTU1_ECO24,Elongation factor Tu 1 OS=Escherichia coli O139:H28 (strain E24377A / ETEC) GN=tuf1 PE=3 SV=1,58,43427,2,0.25
EFTS_ECOBW,Elongation factor Ts OS=Escherichia coli (strain K12 / MC4100 / BW2952) GN=tsf PE=3 SV=1,53,30518,1,0.17
DEOD_ECOBW,Purine nucleoside phosphorylase DeoD-type OS=Escherichia coli (strain K12 / MC4100 / BW2952) GN=deoD PE=3 SV=1,51,26161,1,0.2
GRCA_ECOBW,Autonomous glycyl radical cofactor OS=Escherichia coli (strain K12 / MC4100 / BW2952) GN=grcA PE=3 SV=1,37,14332,1,0.39
